Identifier,Title,Subtitle,Author,Description,Language,Page count,Subject,Currency,Price
LIFESHEETS_V1_2_HUB,LifeSheets v1.2: EF-Architecture,The Beastmode Hub,Timothy Walton,"THE BEASTMODE HUB: The central nervous system for your executive function. Organize all 10 LifeSheets modules, track system status, and manage your tactical deployment. Optimized for high-performance individuals, traders, and neurodivergent professionals. GET FULL ACCESS: https://buy.stripe.com/4gMcN70AW0ILdxXdrQ6wE1p",en,50,SEL021000,USD,0.00
LIFESHEETS_V1_2_SPOON,LifeSheets v1.2: Spoon Budgeter,Tactical Energy Management,Timothy Walton,"TACTICAL ENERGY MANAGEMENT: Stop burning out. The Spoon Budgeter treats your energy like a finite currency. Track cognitive load, physical strain, and emotional bandwidth with institutional precision. GET FULL ACCESS: https://buy.stripe.com/4gMcN70AW0ILdxXdrQ6wE1p",en,50,SEL021000,USD,0.00
LIFESHEETS_V1_2_SOLVER,LifeSheets v1.2: Decision Solver,Institutional Logic Engine,Timothy Walton,"INSTITUTIONAL LOGIC ENGINE: Remove emotion from high-stakes decisions. Use weighted matrix analysis and Bayesian logic to solve complex problems in trading and life. GET FULL ACCESS: https://buy.stripe.com/4gMcN70AW0ILdxXdrQ6wE1p",en,50,SEL021000,USD,0.00
LIFESHEETS_V1_2_SOP,LifeSheets v1.2: ADHD SOP Builder,Recursive Workflow Logic,Timothy Walton,"RECURSIVE WORKFLOW LOGIC: Deconstruct complex tasks into atomic, executable SOPs. Designed for the ADHD brain to eliminate task paralysis and ensure repeatability. GET FULL ACCESS: https://buy.stripe.com/4gMcN70AW0ILdxXdrQ6wE1p",en,50,SEL021000,USD,0.00
LIFESHEETS_V1_2_RAM,LifeSheets v1.2: Cognitive RAM,Immediate Action Terminal,Timothy Walton,"IMMEDIATE ACTION TERMINAL: Clear your mental cache. A high-speed capture system for thoughts, tasks, and alerts before they disappear. Your external hard drive for focus. GET FULL ACCESS: https://buy.stripe.com/4gMcN70AW0ILdxXdrQ6wE1p",en,50,SEL021000,USD,0.00
LIFESHEETS_V1_2_HABIT,LifeSheets v1.2: Beastmode Habit Tracker,High-Performance Persistence,Timothy Walton,"HIGH-PERFORMANCE PERSISTENCE: Data-driven habit formation. Track streaks, identify blockers, and optimize your routine with cold, hard metrics. No fluff. GET FULL ACCESS: https://buy.stripe.com/4gMcN70AW0ILdxXdrQ6wE1p",en,50,SEL021000,USD,0.00
LIFESHEETS_V1_2_S3,LifeSheets v1.2: S3 Strain Index,Executive Load Balancing,Timothy Walton,"EXECUTIVE LOAD BALANCING: Monitor your system's S3 (Stress, Sleep, Strain) metrics to prevent executive dysfunction. Balanced load leads to peak performance. GET FULL ACCESS: https://buy.stripe.com/4gMcN70AW0ILdxXdrQ6wE1p",en,50,SEL021000,USD,0.00
LIFESHEETS_V1_2_OS,LifeSheets v1.2: Tactical Life OS,The Command Interface,Timothy Walton,"THE COMMAND INTERFACE: Your daily executive dashboard. Merges schedules, top priorities, and system alerts into a single, high-contrast mission control. GET FULL ACCESS: https://buy.stripe.com/4gMcN70AW0ILdxXdrQ6wE1p",en,50,SEL021000,USD,0.00
LIFESHEETS_V1_2_WHALE,LifeSheets v1.2: Whale Stalker Lite,Market Intelligence Feed,Timothy Walton,"MARKET INTELLIGENCE FEED: Track institutional capital flows. A simplified version of the professional Whale Stalker for retail traders monitoring 'smart money'. GET FULL ACCESS: https://buy.stripe.com/4gMcN70AW0ILdxXdrQ6wE1p",en,50,SEL021000,USD,0.00
LIFESHEETS_V1_2_SENTINEL,LifeSheets v1.2: Sentinel Alerts,Autonomous Monitoring System,Timothy Walton,"AUTONOMOUS MONITORING SYSTEM: Set custom triggers for market movements, task deadlines, or system thresholds. Your automated lookout for mission-critical events. GET FULL ACCESS: https://buy.stripe.com/4gMcN70AW0ILdxXdrQ6wE1p",en,50,SEL021000,USD,0.00
